{
  "schema_version": "1.0",
  "message_id": "msg-v2-schema-001",
  "sender_type": "system",
  "sender_id": "schema-lock",
  "from": "system",
  "to": "all",
  "intent": "task",
  "ref": null,
  "task_id": "task-ail-platform-v2-001",
  "conversation_id": "conv-platform-v2",
  "correlation_id": "corr-schema-lock",
  "lang": "ail/1.1",
  "body": "Lock Phase 2 schemas before runtime.",
  "source": "internal",
  "source_ref": "data/messages/msg-v2-schema-001.json",
  "source_revision": null,
  "body_hash": null,
  "ingested_at": "2026-09-25T05:18:00Z",
  "created_at": "2026-09-25T05:18:00Z",
  "idempotency_key": "msg-v2-schema-001"
}
