{
  "schema_version": "1.0",
  "message_id": "msg-ping-loop-001",
  "sender_type": "system",
  "sender_id": "relay-test",
  "from": "system",
  "to": "agent-a",
  "intent": "ping",
  "ref": null,
  "lang": "ail/1.1",
  "body": "ping",
  "source": "internal",
  "created_at": "2026-09-25T05:23:00Z",
  "idempotency_key": "msg-ping-loop-001"
}
